{
  "slug": "kosa_addictive_design_off_minor",
  "capability": "lens",
  "category": "algorithmic",
  "statutes": [
    {
      "jurisdiction": "US",
      "citation": "KOSA-§4(b)(1)",
      "url": "https://www.congress.gov/bill/118th-congress/senate-bill/1409/text"
    }
  ],
  "summary": "Autoplay, infinite scroll, streak counters, and re-engagement notifications disabled for minors. Each addictive surface evaluated independently.",
  "applies_to_ages": ["6-9", "10-12", "13-15", "16-17"],
  "default_outcome": "deny",
  "introduced_in": "v1.0"
}
