{
  "slug": "coppa2_targeted_ad_ban_under17",
  "capability": "lens",
  "category": "advertising",
  "statutes": [
    {
      "jurisdiction": "US",
      "citation": "COPPA-2.0-§1303(b)",
      "url": "https://www.congress.gov/bill/118th-congress/senate-bill/1418/text"
    }
  ],
  "summary": "Behavioral / targeted advertising banned for users under 17. Contextual ads on age-appropriate inventory remain permitted.",
  "applies_to_ages": ["0-5", "6-9", "10-12", "13-15", "16-17"],
  "default_outcome": "deny",
  "introduced_in": "v1.0"
}
